{
  "schema_version": 1,
  "id": "builtin.arrangement.quadrant-motion-128",
  "revision": 1,
  "name": "Quadrant Motion · 128",
  "ppq": 960,
  "tempo_map": { "points": [{ "time_tick": 0, "bpm": 128 }] },
  "time_signatures": [{ "time_tick": 0, "numerator": 4, "denominator": 4 }],
  "length_ticks": 30720,
  "tracks": [
    {
      "id": "quadrants",
      "name": "Quadrant Cues",
      "overlap_policy": "layer",
      "clips": [
        {
          "id": "quadrant-dialogue-a",
          "cue_ref": { "id": "starter.cue.quadrant-motion", "revision": 1 },
          "start_tick": 0,
          "duration_tick": 15360,
          "layer": 0
        },
        {
          "id": "quadrant-dialogue-b",
          "cue_ref": { "id": "starter.cue.quadrant-motion", "revision": 1 },
          "start_tick": 15360,
          "duration_tick": 15360,
          "layer": 0,
          "layer_overrides": [
            {
              "layer_id": "layer_rmrvzr7biw4vox57",
              "parameter_overrides": { "speed": { "type": "scalar", "value": 2 } }
            }
          ]
        }
      ],
      "automation_lanes": [
        {
          "id": "quadrant-ping-speed",
          "target": {
            "scope": "cue_layer",
            "clip_id": "quadrant-dialogue-a",
            "layer_id": "layer_3e3tmku2poix5zrt",
            "parameter_id": "speed"
          },
          "keyframes": [
            {
              "id": "quadrant-ping-speed-start",
              "time_tick": 0,
              "value": { "type": "scalar", "value": 1 },
              "interpolation": "linear"
            },
            {
              "id": "quadrant-ping-speed-end",
              "time_tick": 7680,
              "value": { "type": "scalar", "value": 2 },
              "interpolation": "linear"
            }
          ]
        }
      ]
    }
  ],
  "markers": [
    { "id": "quadrant-start", "time_tick": 0, "name": "Four regions" },
    { "id": "quadrant-variation", "time_tick": 15360, "name": "Rain variation" }
  ]
}
