{
  "schema_version": 1,
  "id": "builtin.arrangement.house-128",
  "revision": 1,
  "name": "House 128",
  "ppq": 960,
  "tempo_map": { "points": [{ "time_tick": 0, "bpm": 128 }] },
  "time_signatures": [{ "time_tick": 0, "numerator": 4, "denominator": 4 }],
  "length_ticks": 122880,
  "tracks": [
    {
      "id": "cues",
      "name": "Cues",
      "overlap_policy": "layer",
      "clips": [],
      "automation_lanes": []
    }
  ],
  "markers": []
}
